{
    "name": "bajo_uruguay",
    "id": 485,
    "topology": "data/topologies/bajo_uruguay.json",
    "procedures": [
        {
            "id": 1,
            "type": "HecRas",
            "input_nodes": [1,2],
            "output_nodes": [3,4,5,6,7,8,9,10,11,12,2],
            "workspace": "/home/leyden/Downloads/HIDROURU_4D",
            "model_path": "/home/leyden/Downloads/HIDROURU_4D/Modelo/",
            "initial_load": false,
            "project_name": "UruguayBajo",
            "model_config": {
                "geometry_file": "g01",
                "plan_file": "p01",
                "unsteady_file": "u01"
            }
        }
    ]
}